{
  "schema_version": "2026-07-14",
  "app_name": "CarMag",
  "created_at": "2026-07-29T10:00:00+09:00",
  "slots": [
    {
      "graphic_id": "home-hero",
      "screen": "01-home",
      "platforms": [
        "web",
        "mobile"
      ],
      "placement": "ヒーロー領域 (ヘッダー直下の大見出し横)",
      "size_role": "hero",
      "state": "default",
      "rationale": "21c 検証用スタブ (POCTEAMA-186 手動テスト)。トップの第一印象を担う代表 slot"
    },
    {
      "graphic_id": "article-thumb",
      "screen": "02-article-detail",
      "platforms": [
        "web"
      ],
      "placement": "記事本文中の挿絵ブロック",
      "size_role": "content",
      "state": "default",
      "rationale": "21c 検証用スタブ (POCTEAMA-186 手動テスト)。代表 slot 選定が hero 優先で効くことの確認用"
    }
  ]
}
